JK,Code,Name,Industry,Market cap.,Amplitude,P/E,Turnover Ratio,Rise rate
,AAALY,AAREAL BANK AG UNSP ADR EA REPR 1 ORD EUR0.00,-,2074000000,0,46.951,0,0
,AABB,ASIA BROADBAND INC,-,43927000,0.06338,0,0.00145,-0.00352
,AACAY,AAC TECHNOLOGIES H,-,4842000000,0.00746,48.675,0,0
,AACIU,ARMADA ACQUISITION CORP I UNIT 1 CL A & 1/2 WT EXP,-,0,0,0,0,0
,AACIW,ARMADA ACQUISITION CORP I C/WTS (TO PUR COM),-,0,0,0,0,0
,AACT.U,Ares Acquisition Corp. II,-,0,0,0,0,0
,AACT.WS,ARES ACQUISITION CORPORATION II C/WTS (TO PUR COM),-,0,0.1,0,0,-0.05263
,AAGC,ALL AMERICAN GOLD CORP,-,1054000,0.33333,0,0.00099,0
,AAGH,AMERICA GREAT HEALTH,-,63321000,0.03448,-83.333,0,0
,AAGIY,AIA GROUP LTD,-,79533000000,0.02356,21.598,0.00013,-0.00105
,AAGRW,AFRICAN AGRICULTURE HOLDINGS INC C/WTS 06/12/2028(TO PUR COM),-,0,0,0,0,0
,AAGRY,ASTRA AGRO LESTARI TBK UNSP ADR EA REPR 5 SHS,-,689038000,0,10.719,0,0
,AAPI,APPLE ISPORTS GROUP INC,-,1232000000,0,-300,0,0
,AAPJ,AAP INC,-,471575,1,0,0.00273,0
,AAPT,ALL AMERICAN PET COMPANY INC,-,2744,0,0,0.00001,0
,AAQL,ANTIAGING QUANTUM LIVING INC,-,29845000,0,-99.5,0,0
,AARTY,AIRTEL AFRICA PLC UNSPON ADS EACH REP 10 ORD SHS,-,5237000000,0,-31.886,0,0
,AASP,GLOBAL ACQUISITIONS CORP,-,1200000,0,-21.2,0,0
,AASZD,ATLANTIC SAPPHIRE ASA,-,94844000,0,-0.242,0,0
,AATC,Autoscope Technologies,-,31988000,0.05346,4.805,0.00537,0
,AATRL,AMG CAPITAL TR II 5.15% CONV PRF 15/10/2037,-,0,0,0,0,0
,AATV,ADAPTIVE AD SYSTEMS INC,-,12297000,0,0,0,0
,AAVMY,ABN AMRO BANK N.V. UNSPON ADS EACH REP 1 ORD SHS,-,13662000000,0.00878,5.13,0.00002,-0.0034
,AAWH,ASCEND WELLNESS HLDGS INC,-,188795000,0.03657,-3.698,0.00022,-0.00415
,ABBB,"Auburn Bancorp, Inc.",-,4283000,0,65.462,0,0
,ABBNY,ABB LTD SPON ADR EACH REP 1 ORD SHS,-,102945000000,0.00682,27.721,0.00027,-0.00179
,ABCP,AMBASE CORP,-,21235000,0.04255,-1.923,0.00016,0
,ABDBY,ALM. BRAND UNSPON ADS EACH REP 2 ORD SHS,-,3060000000,0,35.13,0,0
,ABHBY,ALFEN BEHEER B V UNSPN ADS ECH REP 1 ORD SHS,-,651588000,0,20.604,0,0
,ABIT,ATHENA BITCOIN GLOBAL,-,389178000,0.18181,0,0.00002,0
,ABLLL,ABACUS LIFE INC 9.875% SENIOR NOTES 15/11/2028 USD25,-,0,0.01171,0,0,0
,ABLLW,ABACUS LIFE INC C/WTS 30/06/2028 (TO PUR COM),-,0,0.36574,0,0,0
,ABLT,AMERICAN BILTRITE INC,-,2809000,0,0,0,0
,ABLVW,ABLE VIEW GLOBAL INC C/WTS 30/09/2028 (TO PUR COM),-,0,0,0,0,0
,ABMC,AMERICAN BIO MEDICA CORP,-,4809,0,-0.003,0.00004,0
,ABMT,ADVANCED BIOMEDICAL TECHNOLOGIES,-,42542,0,-0.06,0,0
,ABQQ,AB INTL GROUP CORP,-,466445,0,-0.05,0.00479,0
,ABR.PRD,ARBOR REALTY TRUST INC 6.375% SERIES D CUMULATIVE RED PFD STK,-,0,0.02247,0,0,0
,ABR.PRE,ARBOR REALTY TRUST INC SER E CUM RED PFD SHS,-,0,0.00576,0,0,-0.0022
,ABR.PRF,ARBOR REALTY TRUST INC 6.25% SER F FXD/FLTG RATE CUMULATIVE PFD,-,0,0.007,0,0,-0.003
,ABTI,ALTEROLA BIOTECH INC,-,27653000,0.1875,-10,0,0
,ABTO,AB&T FINANCIAL CORPORATION,-,1841000,0,0,0,0
,ABTZY,ABOITIZ EQUITY VENTURE INC UNSPON ADR EA REPR 10 ORD PHP1.00,-,4548000000,0,11.475,0,0
,ABVG,AFFINITY BEVERAGE GROUP INC,-,0,0,0,0,0
,ABZPY,ABOITIZ POWER CORPORATION UNSPON ADR EA REPR 20 ORD PHP1.00,-,4565000000,0,8.249,0,0
,ACABU,ATLANTIC COASTAL ACQUISITIO CORP II UNIT 1 CL A & 1/2 RED WT EXP,-,0,0,0,0,0
,ACABW,ATLANTIC COASTAL ACQUISITIO CORP II C/WTS (TO PUR COM),-,0,0,0,0,0
,ACACU,Acri Capital Acquisition Corp.,-,0,0,0,0,0
,ACACW,ACIES ACQUISITION CORP C/WTS 30/11/2027(TO PUR COM),-,0,0.08333,0,0,0
,ACAI,SAFEPLUS INTL HLDGS LTD,-,3173,0,0,0,0
,ACAN,AMERICANN INC,-,1083000,0.11,-11.1,0.00107,0
,ACBD,ANNABIDIOL CORP,-,39910000,0,0,0,0
,ACBM,ACRO BIOMEDICAL CO LTD,-,6304000,0,-0.404,0,0
,ACCR,ACCESS-POWER & CO INC,-,422100,0,107.692,0,0
,ACCYY,ACCOR SA SPON ADR EA REPR 0.2 ORD SHS,-,10028000000,0.00897,17.421,0,0
,ACEND,ASCENTIAL PLC UNSPON ADS EACH REP 2 ORD (POST SPLIT),-,1548000000,0,-8.156,0,0
,ACER,ACER THERAPEUTICS INC,-,16149000,0,-0.398,0,0
,ACEYY,ACER INC GDR EACH REPR 5 ORD TWD10 REG S (CIT),-,4810000000,0,31.621,0,0
,ACFN,ACORN ENERGY INC,-,22261000,0,179,0.00016,0
,ACGBY,AGRICULTURAL BK CH,-,149793000000,0.00549,4.316,0,0
,ACGLN,ARCH CAPITAL GROUP DEP SHS EACH REP 1/1000TH NCUM PFD SER G,-,0,0.01192,0,0,0.00312
,ACGX,ALLIANCE CREATIVE GROUP INC,-,850754,0,0.211,0,0
,ACHHY,Aluminum Corporation Of China,-,6936000000,0,10.274,0,0
,ACHR.WS,ARCHER AVIATION INC C/WTS 16/09/2026 (TO PUR COM),-,0,0.25276,0,0,0
,ACKAY,ARCELIK UNSP ADR EACH REPR 5 ORD,-,2842000000,0,12.147,0,0
,ACLEW,ALTERNUS CLEAN ENERGY INC C/WTS (TO PUR COM),-,0,0,0,0,0
,ACLLY,ACCELLERON INDUSTRIES AG UNSPON ADR EACH REP 1 ORD SHS,-,3682000000,0.01813,36.361,0.00001,0
,ACMB,AGRO CAPITAL MANAGEMENT CORP,-,574271,0,0,0,0
,ACMT,ACMAT CORP,-,23904000,0,0,0,0
,ACMTA,ACMAT CORP,-,25832000,0,0,0,0
,ACNE,ALICE CONS MINES INC,-,0,0,0,0,0
,ACONW,ACLARION INC C/WTS (TO PUR COM),-,0,0.08576,0,0,0
,ACOPY,THE A2 MILK COMPANY LTD UNSPON ADS EACH REP 1 ORD SHS,-,3072000000,0.03236,32.946,0,0
,ACORQ,Acorda Therapeutics,-,345675,0.07176,-0.001,0.00413,0
,ACP.PRA,ABRDN INCOME CREDIT STRATEGIES FUND 5.250% CUM PERPETUAL PFD STOCK SER A,-,0,0.01363,0,0,-0.01344
,ACPS,AC PARTNERS INC,-,493887,0,0,0,0
,ACR.PRC,ACRES COMMERCIAL REALTY CORP 8.625% CUM RED FXD TO FLOATING PRF SER C,-,0,0.0028,0,0,0
,ACR.PRD,ACRES COMMERCIAL REALTY CORP 7.875% CUM RED PREF SER D,-,0,0.01146,0,0,0
,ACRG,AMERICAN CLEAN RESOURCES GROUP,-,110304000,0,-19.615,0,0
,ACRL,ATACAMA RESOURCES INTERNATIONAL INC,-,7493000,0,0,0,0
,ACSAY,ACS ACTIVIDADES DE CONSTRUCCION Y UNSP ADR EACH REPR 0.2 ORD,-,10389000000,0.00815,17.016,0,0
,ACUR,Acura Pharmaceuticals Inc,-,1815000,0,-1.375,0,0
,ACUT,ACCUSTEM SCIENCES INC,-,4539000,0,-2.222,0.00014,0
,ADC.PRA,AGREE REALTY CORP DEP SHS EA REP 1/1000 CUM PFD STK SR A,-,0,0.01312,0,0,0.01474
,ADCV,AD CAPITAL US INC,-,74674000,0,0,0,0
,ADDHY,ADDTECH AB UNSPON ADS EACH REP 0.5 ORD SHS,-,5126000000,0,35.985,0,0
,ADDYY,adidas AG,-,41545000000,0.0079,-517.067,0.0001,-0.00011
,ADERY,AIDA ENGINEERING ADR  EACH REPR  10 NPV,-,344008000,0,20.249,0,0
,ADEVY,ADEVINTA ASA UNSPON ADR EACH REP 1/2 OF ORD SHS,-,7497000000,0,-47.969,0,0
,ADGO,ADVANTEGO CORPORATION,-,16293,0,0,0,0
,ADHC,AMERICAN DIVERSIFIED HOLDINGS CORP,-,1013000,0,0,0,0
,ADHI,ARSENAL DIGITAL HOLDINGS INC,-,754420,0,0,0,0
,ADIA,ADIA NUTRITION INC,-,993155,0,0,0,0
,ADLDY,ADBRI LTD UNSP ADR EA REPR 4 ORD SHS,-,1331000000,0,21.68,0,0
,ADMG,ADAMANT DRI PROCESSING & MINLS GRP,-,9756000,0,-28,0,0
,ADMQ,ADM ENDEAVORS INC,-,7324000,0.13006,46.76,0.00158,0
,ADMT,ADM TRONICS UNLIMITED INC,-,4907000,0,-72.6,0.00035,0
,ADNWW,ADVENT TECHNOLOGIES HLDGS INC C/WTS 03/02/2026(TO PUR COM),-,0,0.37654,0,0,0.11437
,ADOOY,ADARO ENERGY INDONESIA TBK UNSP ADR EA REPR 50 SHS,-,5225000000,0.06917,3.186,0.00017,0.03676
,ADPXY,AUDIO PIXELS HLDGS LTD SPON ADR EACH REPR ORD SHS,-,115380000,0,-11.826,0,0
,ADRNY,KONINKLIJKE AHOLD DELHAIZE NV SPON ADR EACH REP 1 ORD SHS (POST SPLIT),-,28263000000,0.0056,14.513,0.00004,-0.00198
,ADRT.U,AULT DISRUPTIVE TECHNOLOGIES CORP UNIT 1 COM & 3/4 WT EXP,-,0,0,0,0,0
,ADRTW,AULT DISRUPTIVE TECHNOLOGIES CORP C/WTS (TO PUR COM),-,0,0,0,0,0
,ADRZY,ANDRITZ AG UNSP ADR EACH REPR 0.2 ORD,-,6111000000,0,11.22,0,0
,ADSEW,ADS TEC ENERGY PLC C/WTS (TO PUR COM),-,0,0,0,0,0
,ADTHW,ADTHEORENT HOLDING COMPANY INC C/WTS (TO PUR COM),-,0,0,0,0,0
,ADVWW,Advantage Solutions Inc C/Wts(To Sub For Ord),-,0,0.13771,0,0,0
,ADXS,Ayala Pharmaceuticals,-,11191000,0,-0.094,0.00005,0
,ADYEY,Adyen N.V. Unsponsored ADR,-,37504000000,0.01136,50.333,0.00014,0.00248
,ADYX,ADYNXX INC,-,5,0,0,0,0
,AEAEU,ALTENERGY ACQUISITION CORP UNIT 1 CL A & 1/2 WT EXP,-,0,0,0,0,0
,AEAEW,ALTENERGY ACQUISITION CORP C/WTS (TO PUR COM),-,0,0,0,0,0
,AEBZY,ANADOLU EFES BIRACILIK VE MALT SANA ADR EA REP 0.2 ORD TRY1,-,4115000000,0.00583,6.096,0,0
,AECLY,AECI ADR-EACH CNV INTO 1 ORD ZAR1,-,833590000,0,13.015,0,0
,AECX,ACADIA ENERGY CORPORATION,-,46483000,0,0,0.00001,0
,AEFC,Aegon Funding Company Llc 5.1% Sub Notes Due 15/12/2049 Usd25,-,0,0.00444,0,0,0.00336
,AELIY,ANADOLU HAVAT EMEKLILIK A.S ADR EACH REPR 4 ORD TRY1,-,0,0,0,0,0
,AEMMY,A2A SPA UNSP ADR EACH REPR 5 ORD,-,5157000000,0,7.316,0,0
,AENTW,AENTW,-,0,0.00625,0,0,0
,AEPT,AMERICAN ENERGY PARTNERS INC,-,3895000,0.13643,0,0.00002,0
,AERG,APPLIED ENERGETICS INC,-,360483000,0.05146,-56.333,0.00067,0
,AERS,AERIUS,-,517043,0,0,0,0
,AERTW,WORLDWIDE WEBB ACQUISITION CORP C/WTS 20/10/2026 (TO PUR COM),-,0,0,0,0,0
,AESO,ATLANTIC ENERGY SOLUTIONS INC,-,642444,0,0,0,0
,AEVA.WS,AEVA TECHNOLOGIES INC C/WTS 12/03/2026 (TO PUR COM),-,0,0.05004,0,0,0
,AEXAY,ATOS SE UNSPONS ADR EACH REPR 0.2 ORD EUR1,-,132632000,0.02894,-0.036,0.00005,-0.0075
,AEYGQ,ADDvantage Technologies Group,-,44841,0,0.1,0.00119,0
,AFARU,Aura Fat Projects Acquisition Corp.,-,0,0,0,0,0
,AFARW,AURA FAT PROJECTS ACQUISITION CORP C/WTS (TO PUR ORD),-,0,0,0,0,0
,AFDG,AFRICAN DISCOVERY GROUP INC,-,3519000,0,0,0,0
,AFFL,AFFILIATED RESOURCES CORP,-,491082,0,0,0.00027,0
,AFFS,AMTRUST FINANCIAL SERVICES INC 7.25% PRF 15/06/2055 USD25,-,0,0,0,0,0
,AFFU,AFFLUENCE CORPORATION,-,7089000,0.19166,0,0.00307,0
,AFGB,American Financial Group Inc Ohio 5.875% Subord Deb Due 30/03/2059 Usd25,-,0,0.00774,0,0,0.00385
,AFGC,American Financial Group Inc Ohio 5.125% Subord Deb Due 15/12/2059 Usd25,-,0,0.0072,0,0,0.00047
,AFGD,American Financial Group Inc Ohio 5.625% Subordinated Deb Due 01/06/2060,-,0,0.0549,0,0,-0.00796
,AFGE,"American Financial Group Inc 4.50% Subordinated Debentures due September 15, 2060",-,1685000000,0.00749,0,0.00005,0
,AFGVY,AGFA GEVAERT NV UNSP ADR EACH REPR 2 ORD,-,201267000,0,-1.84,0,0
,AFIB,Acutus Medical,-,1336000,0.13348,-0.016,0.00217,0
,AFIIQ,Armstrong Flooring,-,2177,0,0,0.00005,0
,AFJKR,AIMEI HEALTH TECHNOLOGY CO LTD COM USD0.0001 (SUB/RIGHTS 17/11/2028),-,0,0,0,0,0
,AFJKU,Aimei Healthcare Technology Co. Ltd.,-,0,0,0,0,0.00667
,AFLYY,AIR FRANCE-KLM SPON ADR EACH REP 0.1 SHS,-,2744000000,0.01876,23.75,0,0
,AFNL,AMFIN FINANCIAL CORP,-,30838000,0.00502,0,0.00069,0
,AFOM,ALL FOR ONE MEDIA CORP,-,3,0,0,0,0
,AFRIW,FORAFRIC GLOBAL PLC C/WTS 09/06/2027 (TO PUR ORD),-,0,0.00006,0,0,0
,AFSIA,AMTRUST FINANCIAL SERVICES INC 6.75% NON-CUM PFD SER'A'USD25,-,0,0,0,0,0
,AFSIM,AMTRUST FINANCIAL SERVICES INC 7.75% DEP SHS REPSTG 1/40 NON-CUM PFD E,-,0,0.02906,0,0,0
,AFSIN,AMTRUST FINANCIAL SERVICES INC DEP SHS REP 1/40TH INT NON CUM PFD SR F,-,0,0.0223,0,0,0
,AFSIP,AMTRUST FINANCIAL SERVICES INC 7.50% DEP SHS REP 1/40TH PFD SER D USD25,-,0,0.00594,0,0,0
,AFTWS,ARK7 PPTYS PLUS LLC,-,0,0,0,0,0
,AGAEW,ALLIED GAMING C/WTS 09/08/2024 (TO PUR COM),-,0,0.5,0,0,0
,AGBAW,Agba Acquisition Limited C/Wts 10/05/2024 (To Pur Com),-,0,0.25534,0,0,0
,AGDY,AGRI DYNAMICS INC,-,5051000,0,0,0,0
,AGESY,AGEAS SPON ADR EACH REP 1 ORD (POST REV-SPLIT),-,8546000000,0.00203,8.376,0.00001,0
,AGGI,ALLIED ENERGY INC FLA,-,14140000,0,0,0,0
,AGILQ,AgileThought,-,52,0,0,0,0
,AGIN,AMERICAN GRAPHITE TECHNOLOGIES INC,-,838685,0.55,-16.807,0.00002,0
,AGLXY,AGL ENERGY SPON ADS EACH REP 1 ORD SHS,-,4533000000,0,-5.386,0,0
,AGLY,ATLANTIS GLORY INC,-,1238000000,0,-18141.593,0,0
,AGM.PRC,FEDERAL AGRICULTURAL MORTGAGE CORP 6% NON-CUM PFD SER'C'USD25.00,-,0,0,0,0,0
,AGM.PRD,FEDERAL AGRICULTURAL MORTGAGE CORP 5.7% NON CUMULATIVE PREFERRED STK SER D,-,0,0.01255,0,0,0
,AGM.PRE,FEDERAL AGRICULTURAL MORTGAGE CORP 5.7% NON CUMULATIVE PREFERRED STK SER E,-,0,0.00886,0,0,0
,AGM.PRF,FEDERAL AGRICULTURAL MORTGAGE CORP 5.250% NON CUM PREF STOCK SR F,-,0,0.00888,0,0,-0.00094
,AGM.PRG,FEDERAL AGRICULTURAL MORTGAGE CORP 4.875% NON CUMULATIVE PREF STOCK SR G,-,0,0.0137,0,0,0.00025
,AGNCL,AGNC INVESTMENT CORP DEP SHS REPSTG 1/1000TH PFD SER G,-,0,0.01119,0,0,0
,AGNCM,AGNC Investment Corp,-,0,0.00354,0,0,0.00039
,AGNCO,AGNC Investment Corp,-,0,0.002,0,0,-0.0002
,AGPYY,AGILE GROUP HOLDIN,-,604516000,0,-0.303,0,0
,AGRIW,AGRIFORCE GROWING SYS LTD C/WTS 01/02/2024 (TO PUR COM),-,0,2,0,0,0
,AGRPY,ABSA GROUP LTD SPON ADR EA REPR 2 ORD SHS,-,7934000000,0,7.192,0,0
,AGRX,Agile Therapeutics,-,2173000,0.06766,-0.047,0.00044,0
,AGSS,AMERIGUARD SEC SVCS INC,-,45560000,0.35135,480,0.00088,0
,AGTT,ANGSTROM TECHNOLOGIES INC,-,4057000,0,0,0,0
,AGTX,AGENTIX CORP,-,1420000,0,-0.886,0,0
,AGXRW,AGILE THERAPEUTICS INC C/WTS 13/10/2026 (TO PUR COM),-,8302,0,0,0,0
,AGYP,ALLIED ENERGY CORPORATION NEVADA,-,292100,0.04583,0,0.00094,0
,AHCHY,ANHUI CONCH CEMENT,-,12680000000,0.01288,8.817,0.00001,0
,AHEXY,Adecco Group AG Unsponsored ADR,-,5820000000,0.0045,16.645,0.00005,0
,AHH.PRA,ARMADA HOFFLER PPTYS INC 6.75% CUM RED PERP PREF STOCK SERIES A,-,0,0.01094,0,0,0
,AHIX,ALUF HLDGS INC,-,14929000,0,0,0,0
,AHKSY,Asahi Kasei (ADR),-,8615000000,0.01872,31.231,0.00011,0.00161
,AHL.PRC,ASPEN INSURANCE HLDGS 5.95%NON CUM FXD FLTG RTE PERP PFD USD25,-,0,0.01202,0,0,-0.00154
,AHL.PRD,ASPEN INSURANCE HLDGS 5.625%NON CUM PERP PFD SHS USD25,-,0,0.01137,0,0,0.00066
,AHL.PRE,ASPEN INSURANCE HLDGS 5.625 DEP SHS REP 1/1000TH PFD SHS,-,0,0.01143,0,0,0
,AHNR,ATHENA GOLD CORP,-,5307000,0.25581,7.65,0.00379,0
,AHPIQ,Allied Healthcare Products,-,401,0,0,0,0
,AHRO,AUTHENTIC HOLDINGS INC,-,861574,0,-0.4,0,0
,AHRT,AMERICAN HEALTHCARE REIT INC,-,1435000000,0,-10.093,0,0
,AHT.PRD,ASHFORD HOSPITALITY TRUST INC 8.45% CUM PRF STK SER'D' USD25,-,0,0.02877,0,0,0
,AHT.PRF,ASHFORD HOSPITALITY TRUST INC 7.375% PFD CUM SER F USD25,-,0,0.07057,0,0,-0.05072
,AHT.PRG,ASHFORD HOSPITALITY TRUST INC CUM PFD SER G,-,0,0,0,0,0
,AHT.PRH,ASHFORD HOSPITALITY TRUST INC 7.50% CUMULATIVE PRFD STK SER H USD25,-,0,0,0,0,0
,AHT.PRI,ASHFORD HOSPITALITY TRUST INC 7.5% CUM PREF SHS SERIES I USD25,-,0,0,0,0,0
,AHTR,AMERICAN HEALTHCARE REIT INC,-,1443000000,0,-10.148,0,0
,AIAD,AIADVERTISING INC,-,269550,0,-0.02,0.0001,0
,AIAGY,AURUBIS AG ADR EACH REPR 0.5 SHS,-,3415000000,0,22.633,0,0
,AIBGY,AIB GROUP PLC UNSPON ADR EACH REP 2 ORD SHS,-,13192000000,0,6.728,0,0
,AIFLY,AIFUL CORP ADR EACH REP 0.5 ORD NPV,-,1364000000,0,9.93,0,0
,AIFS,AGENT INFORMATION SOFTWARE INC,-,7912000,0,0,0,0
,AIIXY,AIXTRON SE UNSPON ADR EACH REP 2 ORD SHS,-,2250000000,0,14.488,0,0
,AIJTY,Jianpu Technology Inc,-,9199000,0.23809,-2.639,0.0053,0
,AIKO,ALTERNATIVE INVT CORP,-,117827,0,-0.034,0,0
,AILEW,ILEARNINGENGINES INC C/WTS 16/04/2029 (TO PUR COM),-,0,0.18914,0,0,0.01425
,AILIH,AMEREN ILLINOIS CO 4.08% CUM SER PFD STK,-,0,0,0,0,0
,AILIM,AMEREN ILLINOIS CO 4.7% CUM SER PFD STK USD50,-,0,0,0,0,0
,AILIN,AMEREN ILLINOIS CO 4.42% CUM SER PFD STK USD50,-,0,0,0,0,0
,AILIO,AMEREN ILLINOIS CO 4.26% CUM SER PFD STK USD50,-,0,0.00073,0,0,0
,AILIP,AMEREN ILLINOIS CO 4.2% CUM SER PFD STK USD50,-,0,0,0,0,0
,AILLI,AMEREN ILLINOIS CO 5.16% PRF USD100,-,0,0,0,0,0
,AILLM,AMEREN ILLINOIS CO 4.92% PREF USD100,-,0,0,0,0,0
,AILLN,AMEREN ILLINOIS CO 4.9% PREF USD100,-,0,0,0,0,0
,AILLO,AMEREN ILLINOIS CO 4.25% PRF USD100,-,0,0,0,0,0
,AILLP,AMEREN ILLINOIS CO 4% CUM PFD USD100,-,0,0,0,0,0
,AIMAU,Aimfinity Investment Corp. I,-,0,0,-25.5,0,0
,AIMAW,AIMFINITY INVESTMENT CORP I C/WTS CL 1 (TO PUR ORD),-,0,0.00497,-0.046,0,0
,AIMBU,AIMFINITY INVESTMENT CORP I UNIT 1 CL A & 1/2 WT CL 2 EXP,-,0,0,-25.636,0,0
,AIMDW,AINOS INC C/WTS 29/07/2027 (TO PUR COM),-,0,0,0,0,0
,AIPG,AI TECHNOLOGY GROUP INC,-,25654,0,0,0,0
,AIPUY,AIRPORTS OF THAILAND PUBLIC CO UNSP ADR EACH REP 10 ORD SHS,-,23233000000,0,96.233,0,0
,AIQUY,Air Liquide SA Unsponsored ADR,-,111772000000,0.02615,33.958,0.00004,0
,AIRJW,MONTANA TECHNOLOGIES CORP C/WTS 14/03/2029(TO PUR COM),-,0,0.08107,0,0,0
,AIRTP,Air T Inc,-,0,0,0,0,0
,AIRYY,AIR CHINA LTD SPONS ADR EAC REP 20 'H' SHS CNY1,-,8504000000,0,-53.109,0,0
,AISPW,AIRSHIP AI HOLDINGS INC C/WTS 21/12/2028(TO PUR COM),-,0,0.31404,0,0,0
,AITRR,AI TRANSPORTATION ACQUISITION CORP COM USD0.0001 (SUB/RIGHTS),-,0,0,0,0,0
,AITRU,AI Transportation Acquisition Corp.,-,0,0,0,0,0
,AITUY,ANRITSU CORP UNSP ADS EA REPR 1 ORD,-,0,0.02733,0,0,0
,AITX,Artificial Intelligence Technology Solutions Inc.,-,43339000,0.08888,-1.4,0.00633,-0.06666
,AIXN,AIXIN LIFE INTERNATIONAL INC,-,16600000,0,-7.905,0,0
,AIZN,ASSURANT INC 5.25% SUB NOTES DUE 15/01/2061,-,0,0.00524,0,0,0
,AJINY,Ajinomoto (ADR),-,17732000000,0.01317,33.067,0.00004,-0.01247
,AJOY,AYUJOY HERBALS LTD,-,1268000,0,0,0,0
,AJYG,AJ1G INC,-,601321,0,0,0,0
,AKBTY,AKBANK TURK ANONIM SIRKETI ADR REP 2 ORD TRY1,-,10348000000,0.04166,5.096,0.00002,0
,AKOM,AERKOMM INC,-,45959000,0,-1.429,0,0
,AKRBY,AKER BP ASA UNSPON ADS EACH REP 1/2 COM,-,15265000000,0,11.415,0,0
,AKRYY,AKER SOLUTIONS ASA UNSP ADR EACH REPR 2 ORD,-,1543000000,0,1.425,0,0
,AKZOY,AKZO NOBEL NV SPON ADS EACH REP 1/3 ORD SHS(R/S),-,10536000000,0.01888,22.37,0.00029,0.00145
,AL.PRA,AIR LEASE CORP 6.150%NON CUM PER PFD FXD FLTG RATE SR A,-,0,0.00755,0,0,0
,ALB.PRA,ALBEMARLE CORP 7.25% DEP SHS REP 1/20TH SER A,-,0,0.04089,0,0,0.02176
,ALBBY,ALIBABA HEALTH INFORMATION TECH LTD UNSPON ADR EACH REPR 20 ORD SHS,-,6936000000,0,79.083,0,0
,ALBKY,ALPHA SERVICES AND HOLDINGS S.A SPN ADR EACH REP 0.25 ORD(POST REV SPLIT,-,3637000000,0,5.788,0,0
,ALBY,COMMUNITY CAP BANCSHARES INC,-,24432000,0,6.115,0,0
,ALCYU,Alchemy Investments Acquisition Corp. 1,-,0,0,0,0,0
,ALCYW,ALCHEMY INVTS ACQUISITION CORP 1 C/WTS 30/11/2027 (TO PUR ORD),-,0,0,0,0,0
,ALDA,ATLANTICA INC,-,2,0,0,0,0
,ALDS,APPLIFE DIGITAL SOLUTIONS INC,-,1828000,0,-0.173,0,0
,ALDVD,KIPLIN METALS INC,-,0,0,0,0,0
,ALEDY,ALLIED GROUP,-,1190000000,0,-66.172,0,0
,ALFIQ,ALFI INC,-,16,0,0,0,0
,ALFRY,ALFRESA HOLDINGS CORP UNSPON ADR EA REPR 1 ORD JPY0.00,-,0,0,0,0,0
,ALFUU,Centurion Acquisition Corp.,-,0,0.00099,0,0,0
,ALFVY,ALFA LAVAL AB UNSP ADR EACH REPR 1 ORD,-,18128000000,0.00881,30.082,0.00002,0
,ALGGY,ALLIANCE GLOBAL GROUP UNSP ADR EA REPR 50 ORD SHS PHP1.00,-,1318000000,0,3.934,0,0
,ALID,ALLIED CORP,-,19999000,0.44222,-1.718,0.00096,0
,ALIF,ARTIFICIAL LIFE INC,-,794,0,0,0,0
,ALIZY,ALLIANZ SE UNSPON ADS EACH REP 1/10 ORD SHARES,-,108630000000,0.00812,12.241,0.00018,0.00036
,ALL.PRB,ALLSTATE CORP 5.1% PREF 15/01/2053,-,0,0.0027,0,0,-0.00077
,ALL.PRH,ALLSTATE CORP DEP SHS REP 1/1000 NON CUM PER PRF SER H,-,0,0.00869,0,0,0.00156
,ALL.PRI,ALLSTATE CORP 4.750% DEP SHS REP 1/1000TH PRP PFD SR I,-,0,0.00913,0,0,0.00241
,ALL.PRJ,ALLSTATE CORP DEP SHS REPSTG 1/1000TH NON PERP PFD SER,-,0,0.00551,0,0,-0.00087
,ALMRY,ALMIRRAL S.A. UNSPON ADS EACH REP 1 COM SHS,-,0,0,0,0,0
,ALMU,AELUMA INC,-,36563000,0.07812,-6.388,0.00149,0
,ALNPY,ANA Holdings (ADR),-,8673000000,0.0027,9.711,0,0
,ALOD,ALLIED RESOURCES INC,-,706626,0,0,0,0
,ALORY,ALIOR BANK SA UNSPON ADR EA REPR 0.50 ORD PLN0.00,-,3739000000,0,7.447,0,0
,ALPE,ALPHA-EN CORPORATION,-,3887,0,-0.001,0,0
,ALPIB,ALPINE BKS COLO,-,224752000,0.02953,7.635,0.00049,0.00261
,ALPMY,Astellas Pharma (ADR),-,17070000000,0.01916,158.667,0.00012,-0.00104
,ALSAR,ALPHA STAR ACQUISITION CORPORATION COM USD0.001 (30/05/2023 SUB/RIGHTS),-,0,0,0,0,0
,ALSAU,ALPHA STAR ACQUISITION CORPORATION UNIT 1 COM & 1 RT & 1 WT,-,0,0,0,0,0
,ALSAW,ALPHA STAR ACQUISITION CORPORATION C/WTS 30/08/2027 (TO PUR COM),-,0,0.32679,0,0,0
,ALSMY,ALSTOM UNSP ADR EACH REPR 0.10 ORD,-,7655000000,0.02325,-19.08,0.00019,0.0119
,ALST,ALLSTAR HEALTH BRANDS INC,-,178379,0.14285,0,0.00132,0
,ALTB,ALPINE AUTO BROKERS INC,-,2230000000,0,-74626.866,0,0
,ALTD,ALTITUDE INTERNATIONAL INC,-,196870,0,-0.02,0,0
,ALTG.PRA,ALTA EQUIPMENT GROUP INC 10% DEP SH 1/1000TH CUM PFD SER A USD25,-,0,0.01064,0,0,0
,ALTX,ALTEX INDUSTRIES INC,-,2667000,0,-23.5,0,0
,ALUR.WS,ALLURION TECHNOLOGIES INC C/WTS 31/07/2029 (TO PUR COM),-,0,0.20695,0,0,0
,ALVOW,ALVOTECH C/WTS (TO PUR COM),-,0,0,0,0,0
,ALYI,ALTERNET SYSTEMS INC,-,2140000,0.14285,0,0.00024,0
,AMADY,AMADEUS IT GROUP SA UNSP ADS EA REPR 1 ORD SH,-,29725000000,0.00713,26.246,0.0001,0
,AMBBY,AMBU A/S UNSP ADR EACH REP 1 ORD SHS,-,5105000000,0,208.37,0,0
,AMBI.WS,AMBIPAR EMERGENCY RESPONSE C/WTS ( TO PUR COM),-,0,0,0,0,0
,AMBK,AMERICAN BANK INC,-,100868000,0,0,0.00003,0
,AMBP.WS,ARDAGH METAL PACKAGING SA C/WTS 04/08/2026 (TO PUR COM),-,0,0.14047,0,0,0
,AMBZ,AMERICAN BUSINESS BANK,-,276721000,0.00978,6.403,0.00056,0
,AMCF,Andatee China Marine Fuel Services,-,10,0,0,0,0
,AMDLY,AMADA CO LTD ADR-EACH CNV INTO 4 ORD NPV,-,0,0,0,0,0
,AMEN,AMEN PROPERTIES INC,-,25867000,0,7.64,0,0
,AMFC,AMB FINANCIAL CORP,-,16665000,0,7.689,0.00002,0
,AMFL,AMERICAN FILMS INC,-,9684000,0,0,0.00001,0
,AMH.PRG,AMERICAN HOMES 4 RENT 5.875% CUM RED PERP PREF SHS SER G USD25,-,0,0.0067,0,0,0.00067
,AMH.PRH,AMERICAN HOMES 4 RENT 6.25%CUM RED PREP PFD SHS SER H USD25,-,0,0.00544,0,0,0
,AMHG,AMERGENT HOSPITALITY GROUP INC,-,1683,0,-0.001,0,0
,AMIGY,ADMIRAL GROUP UNSP ADR EACH REPR 1 ORD,-,9680000000,0.01453,23.295,0,0
,AMIH,AMERICAN INTERNATIONAL HLDGS CORP,-,39000,0,-0.001,0,0
,AMJT,AMJ GLOBAL TECHNOLOGY,-,155750000,0,-1500,0,0
,AMKBY,A.P. Moller - Maersk A/S Unsponsored ADR,-,25670000000,0.01553,7.172,0.00006,0
,AMLH,AMERICAN LEISURE HOLDINGS INC,-,577460,0,0,0,0
,AMLM,AMERICAN LITHIUM MINERALS INC,-,1876000,0.12063,-0.13,0.00028,0
,AMMJ,AMERICAN CANNABIS COMPANY INC,-,1375000,0.21621,-0.247,0.00102,0
,AMMX,AMERAMEX INTERNATIONAL INC,-,1368000,0,1.615,0,0
,AMNC,AMINCOR INC,-,1770000,0,0,0,0
,AMNCB,AMINCOR INC,-,3405000,0,0,0,0
,AMNE,AMERICAN GREEN GROUP INC,-,0,0,0,0,0
,AMNF,ARMANINO FOOD OF DISTINCTION INC,-,170269000,0.00188,29.665,0.0001,0
,AMNI,AMERICAN NOBLE GAS INC,-,543971,0,-0.113,0,0
,AMNL,APPLIED MINERALS INC,-,48437,0,-0.005,0,0
,AMNP,AMERICAN SIERRA GOLD CORPORATION,-,3954000,0,-195.652,0,0
,AMPE,Ampio Pharmaceuticals,-,147596,0.92307,-0.012,0.00347,0
,AMPGW,AMPLITECH GROUP INC C/WTS 01/01/2026(TO PUR COM),-,0,0,0,0,0
,AMPX.WS,AMPRIUS TECHNOLOGIES INC C/WTS (TO PUR COM),-,0,0.064,0,0,0
,AMRRY,AMERICAN RARE EARTHS LTD,-,79935000,0.0123,-21.951,0.00018,0
,AMSSY,AMS-OSRAM AG UNSPN ADR EACH REP 0.50 ORD SHS,-,1385000000,0.00704,-0.252,0,0
,AMTY,AMERITYRE CORP,-,3649000,0.03827,4.623,0.00046,0
,AMXX,MAXX SPORTS TV INC,-,1098000,0,0,0,0
,ANAS,ALTERNATURALS INC,-,557722,0,0,0,0
,ANDC,ANDOVER BANCORP INC OHIO,-,40669000,0,0,0,0
,ANDR,ANDREA ELECTRONICS CORP,-,68,0,0,0,0
,ANG.PRA,AMERICAN NATIONAL GROUP INC 5.95% DEP SH REP 1/1000 NON CUM PFD SE A,-,0,0.00496,0,0,0.00041
,ANG.PRB,AMERICAN NATIONAL GROUP INC 6.625% DEP SH REP 1/1000 NON CUM PF SR B,-,0,0.00359,0,0,-0.00398
,ANGHW,ANGHAMI INC C/WTS 03/02/2027 (TO PUR COM),-,0,0.31075,0,0,0
,ANGPY,ANGLO AMERICAN PLATINUM LTD SPON ADR EACH REP 0.16667 ORD SHS,-,9006000000,0.0246,12.38,0.00008,0
,ANIOY,ACERINOX SA ADR EACH REPR 0.50 ORD,-,2544000000,0,10.372,0,0
,ANKM,ANKAM INC,-,8656000,0,-30.769,0,0
,ANPCY,ANGLE SPON ADR EACH REPR 10 ORD,-,76260000,0,-2.446,0,0
,ANPDY,ANTA SPORTS PRODUC,-,28326000000,0.01005,20.168,0,0
,ANSCU,Agriculture & Natural Solutions Acquisition Corp.,-,0,0,0,0,0
,ANSCW,AGRICULTURE & NAT SOLUTIONS ACQ COR C/WTS 01/10/2028 (TO PUR COM),-,0,0,0,0,0
,ANSLY,ANSELL UNSPONSORED ADR REPR 4 ORD SHS,-,2470000000,0,14.5,0,0
,ANTH,Anthera Pharmaceuticals Inc,-,26,0,0,0,0
,ANVI,ANVI GLOBAL HOLDINGS INC,-,295077000,0,-1230,0,0
,ANYYY,AENA SME S.A. UNSP ADR EACH REPR 0.1 ORD SHS,-,30150000000,0.02987,17.283,0,0
,ANZGY,Australia & New Zealand Banking Group Ltd,-,57697000000,0.0073,12.712,0.00001,0.00031
,ANZLY,AIR NEW ZEALAND SPON ADR EACH REP 5 ORD SHS,-,1112000000,0,4.424,0,0
,AOAO,ALPHA ONE INC,-,175894000,0,0,0,0
,AOGOU,Arogo Capital Acquisition Corp.,-,0,0,0,0,0
,AOGOW,AROGO CAPITAL ACQUISITION CORP C/WTS 23/03/2028 (TO PUR COM),-,0,0,0,0,0
,AONC,American Oncology Network,-,17873000,0.22222,-2.354,0.01775,0
,AONCW,AMERICAN ONCOLOGY NETWORK INC C/WTS 20/09/2028(TO PUR COM),-,0,0,0,0,0
,AONNY,AEON (ADR),-,18256000000,0.00326,65.027,0.00002,0
,AOXG,"Aoxing Pharmaceutical Company, Inc.",-,1501000,0,0.147,0,0
,AOXY,ADVANCED OXYGEN TECHNOLOGIES,-,395153,0,120,0.00009,0
,AOZOY,Aozora Bank (ADR),-,1822000000,0,-5.804,0,0
,AP.WS,AMPCO-PITTSBURGH CORP C/WTS 01/08/2025 (TO PUR COM) SER A,-,0,0.0019,0,0,0
,APCA.U,AP Acquisition Corp.,-,0,0,0,0,0
,APCXW,APPTECH PAYMENTS CORP C/WTS 17/12/2026 (TO PUR COM),-,0,0,0,0,0
,APELY,Alps Alpine (ADR),-,1913000000,0,-10.197,0.00012,0
,APEMY,APERAM SA NY REGISTRY SHS,-,1932000000,0,8.953,0,0
,APGI,AMERICAN POWER GROUP CORP,-,19799000,0,0,0,0
,APGTQ,APPGATE INC,-,17805000,0.0505,-0.218,0.00032,0
,APHP,AMERICAN PICTURE HOUSE CORP,-,20692000,0.18815,-18.575,0.00018,0
,APLO,APOLLO BANCORP INC,-,19238000,0,11.28,0,0
,APNHY,ASPEN PHARMACARE HLDGS UNSP ADR EACH REP 1 ORD ZAR0.13906,-,5970000000,0.00854,20.55,0,0
,APO.PRA,APOLLO GLOBAL MANAGEMENT INC 6.75% CONV PFD STK SER A,-,0,0.00675,0,0,0.0032
,APOS,APOLLO GLOBAL MANAGEMENT INC 7.625% FXD RESETTABLE JR SUB NOTES 2053,-,0,0.00566,0,0,0.00151
,APPB,APPLIED BIOSCIENCES CORP,-,4400,0,-0.001,0,0
,APPDW,APPLIED DNA SCIENCES INC C/WTS 15/11/2024(TO PUR COM),-,0,0,0,0,0
,APQT,APPLIQATE INC,-,106822,0,0,0,0
,APRU,APPLE RUSH COMPANY INC,-,11968000,0,0,0,0
,APSI,AQUA POWER SYSTEMS INC,-,172041,0,10,0.00494,0
,APTL,ALASKA POWER & TELEPHONE CO,-,66914000,0,0,0,0
,APTY,APT SYSTEMS INC,-,1476000,0.1,0,0.00038,0
,APXIU,APX ACQUISITION CORP I UNIT 1 CL A & 1/2 WT EXP (07/12/2026),-,0,0,0,0,0
,APXIW,APX ACQUISITION CORP I C/WTS (TO PUR COM),-,0,0,0,0,0
,APXYY,APPEN LTD UNSPON ADS EACH REP 0.5 ORD SHARE,-,78088000,0,-0.422,0,0
,APYP,APPYEA INC,-,9582000,0.01176,-3.034,0.00024,0
,AQNB,Algonquin Power & Utilities Corp 6.2% Sub Nt Fix/Flt 2019A 01/07/79 Usd25,-,0,0.00178,0,0,0
,AQUI,AQUAGOLD INTERNATIONAL INC,-,340106,0,0,0,0
,AQUNR,AQUARON ACQUISITION CORP COM USD0.0001 (SUB/RIGHTS 15/07/2026),-,0,0,0,0,0
,AQUNU,Aquaron Acquisition Corp.,-,0,0,0,0,0
,ARAO,AURASOURCE INC,-,2741000,0,-3.95,0,0
,ARAT,ARAX HLDGS CORP,-,114948000,0.22642,-6.006,0.00003,-0.07048
,ARBEW,ARBE ROBOTICS LTD C/WTS (TO PUR COM),-,0,0,0,0,0
,ARBKL,ARGO BLOCKCHAIN PLC 8.75% SENIOR NOTES 30/11/2026,-,0,0.01075,0,0,0.0032
,ARBV,AMERICAN RIVIERA BANCORP,-,96614000,0.02409,9.121,0.00096,0
,ARCAY,ARCADIS NV ADR EA REP 1 ORD EUR0.02,-,5683000000,0,33.155,0,0
,ARDS,Aridis Pharmaceuticals,-,3512000,0.25552,-0.049,0.00069,0
