JK,Code,Name,Industry,Market cap.,Amplitude,P/E,Turnover Ratio,Rise rate
,MIN,MFS Intermediate Income Trust,Asset Management,298710000,0.00384,32.75,0.0006,-0.00191
,MIO,PIONEER MUN HIGH INCOME OPP FD INC,Asset Management,194349000,0.00792,-8.106,0.01171,0
,MIY,Blackrock Muniyield Michigan Quality Fund Inc,Asset Management,334828000,0.01405,-6.271,0.00221,0.00018
,MMD,MainStay MacKay DefinedTerm Municipal Opportunities Fund,Asset Management,458279000,0.00487,-54.7,0.00159,0.0006
,MMT,MFS Multimarket Income Trust,Asset Management,263426000,0.00865,15.467,0.00096,0
,MMU,Western Asset Managed Municipals Fd Inc,Asset Management,446689000,0.00486,-6.867,0.00255,0.00048
,MPA,Blackrock Muniyield Pennsylvania Quality Fund,Asset Management,164198000,0.0079,-6.063,0.00367,-0.00199
,MPV,Barings Participation Investors,Asset Management,174420000,0.01366,9.602,0.00126,0.0006
,MQT,"BLACKROCK MUNIYIELD QUALITY FUND II, INC.",Asset Management,225978000,0.00635,-92.727,0.00162,0
,MQY,Blackrock Muniyield Quality Fund Inc,Asset Management,874215000,0.00531,-121.7,0.00124,-0.00041
,MRCC,Monroe Capital,Asset Management,162714000,0.03693,375.5,0.00317,0.00133
,MSD,Morgan Stanley Emerg Mkts Debt Fd Inc,Asset Management,150735000,0.00536,8.783,0.00396,-0.00057
,MSDL,Morgan Stanley Direct Lending Fund,Asset Management,2157000000,0.07033,9.284,0.03696,0.02684
,MUA,Blackrock Muniassets Fund Inc,Asset Management,155230000,0.00949,46.2,0.00223,-0.00043
,MUC,BlackRock MuniHoldings California Quality Fund Inc,Asset Management,1067000000,0.00678,-5.308,0.00068,-0.0009
,MUE,BlackRock MuniHoldings Quality Fund II Inc,Asset Management,221153000,0.01289,-40.36,0.00197,0.00198
,MUI,Blackrock Muni Interm Duration Fund Inc,Asset Management,889103000,0.00527,205.833,0.00264,0.0004
,MUJ,BlackRock MuniHoldings New Jersey Quality Fund Inc,Asset Management,614123000,0.00266,-5.805,0.00132,0.00044
,MVF,Blackrock Munivest Fund Inc,Asset Management,453007000,0.00278,-39.667,0.00099,0.00014
,MVT,Blackrock Munivest Fund II Inc,Asset Management,230129000,0.00739,67.438,0.0029,-0.00185
,MXE,Mexico Equity and Income Fund Inc,Asset Management,41934000,0.02008,2.127,0.00025,-0.00313
,MXF,Mexico Fund Inc,Asset Management,238270000,0.0137,7.755,0.0022,0.00124
,MYD,Blackrock Muniyield Fund Inc,Asset Management,502599000,0.00653,41.269,0.00216,-0.00088
,MYI,"BLACKROCK MUNIYIELD QUALITY FUND III, INC.",Asset Management,738451000,0.00449,-555.5,0.00283,0
,MYN,"Blackrock Muniyield NY Quality FD, Inc",Asset Management,404780000,0.00771,-5.144,0.00089,0.00048
,NAC,Nuveen California Quality Municipal Income Fund,Asset Management,1653000000,0.00741,14.831,0.00384,-0.00043
,NAD,Nuveen Quality Municipal Income Fund,Asset Management,2736000000,0.00765,61.684,0.00146,0.00042
,NAN,Nuveen New York Quality Municipal Income Fund,Asset Management,346152000,0.00535,-5.968,0.00244,-0.00089
,NAZ,Nuveen Arizona Quality Municipal Income Fund,Asset Management,129642000,0.00402,-6.776,0.00037,0
,NBB,Nuveen Taxable Municipal Income Fund,Asset Management,449152000,0.0052,14.018,0.00153,-0.00065
,NBH,Neuberger Berman Intermediate Muni Fund,Asset Management,309805000,0.0067,87.167,0.00272,0.00047
,NBXG,NEUBERGER BERMAN NXT GEN CON FD INC,Asset Management,1006000000,0.00936,8.868,0.00153,-0.00078
,NCA,Nuveen California Municipal Value Fund Inc,Asset Management,288041000,0.00915,16.415,0.00132,-0.00688
,NCDL,Nuveen Churchill Direct Lending Corp,Asset Management,963713000,0.01139,12.643,0.00868,-0.00512
,NCV,Virtus Convertible & Income Fund,Asset Management,287388000,0.0094,35.333,0.00688,0
,NCZ,Virtus Convertible & Income Fund,Asset Management,216930000,0.01052,28.5,0.00213,0.00352
,NDMO,Nuveen Dynamic Mun Opportunities Fd,Asset Management,635529000,0.00608,41.038,0.00089,-0.0028
,NDP,"Tortoise Energy Independence Fund, Inc.",Asset Management,60245000,0.01483,2.262,0.00888,0
,NEA,Nuveen AMT-Free Quality Municipal Income Fund,Asset Management,3400000000,0.0079,94.75,0.00231,-0.00086
,NFJ,"Virtus Dividend, Interest & Premium Strategy Fund",Asset Management,1150000000,0.00579,12.02,0.00159,0.00247
,NHS,Neuberger Berman High Yield Strategies Fund,Asset Management,206164000,0.00377,49.688,0.00218,0.00315
,NIE,Virtus Equity & Convertible Income Fund,Asset Management,633427000,0.0089,6.743,0.00216,0.0017
,NIM,Nuveen Select Maturities Municipal Fund,Asset Management,111646000,0.00553,897,0.00088,-0.00222
,NKX,Nuveen California AMT-Free Quality Municipal Income Fund,Asset Management,575946000,0.00906,14.259,0.00099,0
,NMAI,NUVEEN MULTI-ASSET INCOME FUND,Asset Management,398434000,0.00671,7.224,0.00213,-0.00335
,NMCO,Nuveen Municipal Credit Opps Fund,Asset Management,602273000,0.01179,-23.383,0.00195,0.00182
,NMFC,New Mountain Finance Corp,Asset Management,1300000000,0.00571,9.863,0.00577,0
,NMI,Nuveen Municipal Income Fund Inc,Asset Management,97697000,0.00412,33.517,0.00139,0
,NML,Neuberger Berman MLP and Energy Income Fund,Asset Management,430041000,0.00393,2.864,0.00318,-0.00197
,NMS,Nuveen Minnesota Quality Municipal Income Fund,Asset Management,65336000,0.00441,-21.712,0.00225,0
,NMT,Nuveen Massachusetts Quality Municipal Income Fund,Asset Management,103410000,0.00815,-27.725,0.00141,-0.00448
,NMZ,Nuveen Municipal High Income Opp Fund,Asset Management,1184000000,0.01108,153,0.00245,-0.00046
,NNY,Nuveen New York Municipal Value Fund Inc,Asset Management,156754000,0.00603,16.275,0.00187,0.0012
,NOAH,Noah Holdings,Asset Management,687828000,0.02669,5.19,0.00559,0
,NOM,Nuveen Missouri Quality Municipal Income Fund,Asset Management,24275000,0.00485,-20.255,0.00166,0
,NPCT,NUVEEN CORE PLUS IMPACT FD,Asset Management,312854000,0.01935,15.324,0.00322,0.00091
,NPFD,NUVEEN VARIABLE RATE PREF & INC FD,Asset Management,434230000,0.00985,-17.618,0.00184,-0.00139
,NPV,Nuveen Virginia Quality Municipal Income Fund,Asset Management,200398000,0.00989,-21.5,0.00166,-0.00178
,NQP,Nuveen Pennsylvania Quality Municipal Income Fund,Asset Management,448474000,0.00249,13.693,0.00029,0
,NRK,Nuveen New York AMT-Free Quality Municipal Income Fund,Asset Management,957407000,0.00639,13.065,0.0017,-0.00045
,NRO,NEUBERGER BERMAN REAL ESTATE SECURITIES INCOME FUND INC,Asset Management,157079000,0.01824,-2.236,0.00111,0.00302
,NTG,"Tortoise Midstream Energy Fund, Inc.",Asset Management,217650000,0.01666,3.47,0.00241,0
,NTRS,Northern Trust,Asset Management,16932000000,0.01417,16.291,0.00945,-0.00006
,NUV,Nuveen Municipal Value Fund Inc,Asset Management,1772000000,0.00526,32.846,0.00206,0
,NUW,Nuveen AMT-Free Municipal Value Fund,Asset Management,244497000,0.00661,28.375,0.00185,-0.00219
,NVG,Nuveen AMT-Free Municipal Credit Income Fund,Asset Management,2648000000,0.00965,95.385,0.00186,0.00161
,NXC,Nuveen CA Select Tax Free Income Port,Asset Management,82391000,0.00615,16.188,0.003,0.00154
,NXG,CUSHING NEXTGEN INFRASTRCTR INCM FD,Asset Management,103340000,0.02533,-3.624,0.00859,0.00163
,NXJ,Nuveen New Jersey Quality Municipal Income Fund,Asset Management,498506000,0.0066,13.286,0.00058,0.00082
,NXN,Nuveen NY Select Tax-Free Income Port,Asset Management,45725000,0.00728,-11.768,0.00297,0
,NXP,Nuveen Select Tax Free Income Portfolio,Asset Management,689348000,0.01442,21.788,0.00173,0
,NZF,Nuveen Municipal Credit Income Fund,Asset Management,2404000000,0.00966,49.64,0.00202,0.00201
,OBDE,Blue Owl Capital Corporation III,Asset Management,1850000000,0.00866,6.206,0.00076,-0.002
,OCCI,OFS Credit,Asset Management,118079000,0.00815,-45.875,0.0086,-0.00068
,OFS,OFS Capital,Asset Management,123597000,0.02023,-230.625,0.00395,0.00206
,OIA,Invesco Muni Income Opps Trust,Asset Management,296824000,0.01438,13.543,0.00134,0.00483
,OPP,RiverNorth/DoubleLine Strategic Opportunity Fund Inc,Asset Management,200998000,0.01766,46.053,0.00619,0.00114
,OWL,Blue Owl Capital,Asset Management,8882000000,0.03125,175.1,0.02576,0.00057
,OXLC,Oxford Lane Capital Corp,Asset Management,1435000000,0.00576,4.813,0.02621,0
,OXLCM,Oxford Lane Capital,Asset Management,568100000,0.00039,0,0.00011,0
,OXSQ,Oxford Square Capital Corp,Asset Management,176775000,0.01013,9.25,0.00411,0.00169
,PAI,Western Asset Investment Grade Income Fund Inc,Asset Management,114417000,0.00834,10.838,0.00036,0.00333
,PAX,Patria Investments,Asset Management,1826000000,0.01722,15.113,0.00897,0
,PCF,High Income Securities Fund,Asset Management,116928000,0.01043,19.618,0.00175,-0.00149
,PCK,PIMCO CA Muni Income Fund II,Asset Management,188032000,0.00857,11.898,0.00119,0
,PCM,Pcm Fund Inc,Asset Management,92610000,0.01152,771,0.00274,0
,PCN,PIMCO Corporate & Income Strategy Fund,Asset Management,712724000,0.00504,14.719,0.00211,0.00114
,PCQ,PIMCO California Municipal Income Fund,Asset Management,177472000,0.00853,12.467,0.00027,0.00053
,PDI,PIMCO Dynamic Income Fund,Asset Management,5754000000,0.00585,27.94,0.00314,-0.00085
,PDO,PIMCO DYNAMIC INCOME OPP FD,Asset Management,1500000000,0.00379,-4.512,0.00276,0.0021
,PDT,John Hancock Premium Div Fund,Asset Management,552842000,0.00976,-12.352,0.00161,0.00178
,PDX,PIMCO DYNAMIC INCOME STRATEGY FUND,Asset Management,949576000,0.00877,5.143,0.00116,-0.0007
,PEO,Adams Natural Resources Fund Inc,Asset Management,580454000,0.01093,56.875,0.00136,-0.00175
,PFD,Flaherty & Crumrine Prefd Inc Fund Inc,Asset Management,133281000,0.00776,64.813,0.00095,-0.00096
,PFG,Principal Financial,Asset Management,18753000000,0.01183,31.376,0.00861,0.00012
,PFL,PIMCO Income Strategy Fund,Asset Management,324993000,0.00613,24.727,0.01596,0
,PFLT,PennantPark,Asset Management,758032000,0.00702,14.753,0.01794,0.00088
,PFN,PIMCO Income Strategy Fund II,Asset Management,618540000,0.01392,23.065,0.00379,0.0028
,PFO,Flaherty & Crumrine Prfd Income Oppo,Asset Management,109850000,0.01313,70,0.00129,0
,PFX,PhenixFIN,Asset Management,95809000,0,3.686,0.00022,0
,PGP,PIMCO Global Stocksplus & Income Fund,Asset Management,85795000,0.0147,8.824,0.00171,0
,PGZ,Principal Real Estate Income Fund,Asset Management,66874000,0.00801,-5.741,0.00241,-0.00049
,PHD,Pioneer Floating Rate Trust,Asset Management,120965000,0.00612,7.697,0.00066,0
,PHK,PIMCO High Income Fund,Asset Management,751094000,0.00625,13.714,0.00274,-0.00104
,PHT,Pioneer High Income Trust,Asset Management,219182000,0.00612,6.073,0.00095,0.00115
,PIM,Putnam Master Intermediate Income Trust,Asset Management,153542000,0.01555,63.6,0.00095,-0.00313
,PMF,PIMCO Municipal Income Fund,Asset Management,238657000,0.01202,13.582,0.00182,0
,PML,PIMCO Municipal Income Fund II,Asset Management,563880000,0.00941,12.672,0.0029,0
,PMM,Putnam Managed Municipal Income Trust,Asset Management,294363000,0.01121,27.174,0.00196,-0.00079
,PMO,Putnam Municipal Opportunities Trust,Asset Management,332102000,0.00391,32.839,0.00152,-0.00007
,PMX,PIMCO Municipal Income Fund III,Asset Management,250710000,0.01193,11.719,0.00198,0.00133
,PNF,PIMCO New York Municipal Income Fund,Asset Management,61984000,0.00626,-2.691,0.00088,0.00102
,PNI,PIMCO New York Municipal Income Fund II,Asset Management,82610000,0.01217,10.681,0.00241,0
,PNNT,PennantPark Investment,Asset Management,488532000,0.00667,-14.404,0.00432,0.00066
,PPT,Putnam Premier Income Trust,Asset Management,341754000,0.00564,-17.75,0.00141,0.00708
,PSBD,Palmer Square Capital BDC,Asset Management,537420000,0.01691,4.98,0.00259,0.00302
,PSEC,Prospect Capital,Asset Management,2319000000,0.01075,-12.907,0.00805,-0.00179
,PSF,Cohen & Steers Select Preferred and Income Fund Inc,Asset Management,233106000,0.01186,13.458,0.00137,-0.00102
,PTA,Cohen & Steers Tax Advtg Pfd Sec,Asset Management,1062000000,0.0073,-274.571,0.001,-0.0015
,PTMN,Portman Ridge Finance Corp,Asset Management,178119000,0.02318,15.95,0.00661,-0.00182
,PWM,Prestige Wealth,Asset Management,7247000,0.07289,-7.009,0.00122,0
,PX,P10 Inc,Asset Management,931306000,0.02045,-137.333,0.01705,-0.0024
,PYN,PIMCO New York Municipal Income Fund III,Asset Management,33562000,0.00686,11.918,0.00099,0
,PZC,PIMCO CA Muni Income Fund III,Asset Management,159187000,0.01123,13.882,0.00224,0
,RA,Brookfield Real Assets Income Fund Inc.,Asset Management,700957000,0.00396,8.427,0.00253,0.00063
,RAND,Rand Capital,Asset Management,41296000,0.03069,6.324,0.00155,0
,RCG,RENN Fund Inc,Asset Management,11646000,0.04431,-13.833,0.0007,0
,RCS,PIMCO Strategic Global Government,Asset Management,282045000,0.00814,24.6,0.00137,-0.00081
,RFI,Cohen & Steers Total Return Realty Fund Inc,Asset Management,296439000,0.00628,8.398,0.00229,-0.00089
,RFM,Rivernorth Flexible Muni Inm Fd Inc,Asset Management,97774000,0.01057,29.611,0.0022,-0.00181
,RFMZ,RIVERNORTH FLEXB MUNI INM FD II INC,Asset Management,343847000,0.02799,21.723,0.00139,0.0007
,RGT,Royce Global Trust,Asset Management,70355000,0.00706,6.744,0.0011,0
,RIV,Rivernorth Opportunities Fund Inc,Asset Management,256580000,0.00919,14.238,0.00203,-0.0025
,RLTY,COHEN & STEERS REAL ESTATE OPP & IN,Asset Management,238963000,0.01266,7.983,0.00229,0.0014
,RMCO,Royalty Management,Asset Management,12534000,0.149,-5.777,0.0295,-0.03724
,RMM,RiverNorth Managed Duration Muni Inc Fd,Asset Management,297870000,0.00727,15.719,0.00181,-0.00251
,RMMZ,RIVERNORTH MANAGED DUR MUN INC FDII,Asset Management,135365000,0.00436,19.524,0.00009,0
,RMT,Royce Micro-Cap Trust Inc,Asset Management,453435000,0.00768,6.121,0.00181,0.00329
,RNP,Cohen & Steers REIT and Preferred Income Fund Inc,Asset Management,958539000,0.0055,8.726,0.00242,0.00199
,RQI,Cohen & Steers Quality Income Realty Fund,Asset Management,1531000000,0.0096,6.509,0.0018,0
,RSF,"RiverNorth Capital and Income Fund, Inc",Asset Management,52135000,0.00657,15.667,0.00258,0.00065
,RVT,Royce Small-Cap Trust,Asset Management,1625000000,0.01409,4.854,0.00123,0.00209
,SABA,SABA CAPITAL INCOME & OPPORTUNITIES FUND II,Asset Management,107935000,0.01312,-9.55,0.00588,0
,SAMG,Silvercrest Asset Management,Asset Management,141851000,0.01458,15.583,0.00511,-0.002
,SAR,Saratoga Investment,Asset Management,312473000,0.00746,32.127,0.00307,-0.00393
,SCD,Lmp Capital & Income Fund Inc,Asset Management,261351000,0.01382,10.304,0.00299,0.0013
,SCM,Stellus Capital Investment,Asset Management,331728000,0.00507,17.188,0.00273,-0.00217
,SDHY,PGIM SHT DUR HIGH YLD OPPORTNTS FD,Asset Management,373550000,0.0046,14.15,0.00127,-0.00066
,SEIC,SEI Investments,Asset Management,8645000000,0.01048,19.017,0.01004,-0.00022
,SII,Sprott,Asset Management,1083000000,0.01665,26.656,0.00427,-0.00164
,SLRC,SLR Investment Corp,Asset Management,864690000,0.01437,11.321,0.00584,0
,SOR,Source Capital Inc,Asset Management,358677000,0.01933,6.723,0.00162,0.00275
,SPE,Special Opportunities Fund Inc,Asset Management,144013000,0.00727,5.496,0.00084,0.00251
,SPXX,Nuveen S&P 500 Dynamic Overwrite Fund,Asset Management,286283000,0.00827,5.97,0.00226,-0.00102
,SRV,NXG Cushing Midstream Energy Fund,Asset Management,122112000,0.01389,27.208,0.00253,0.00167
,SSSS,SuRo Capital,Asset Management,95281000,0.01728,21.474,0.00099,0
,STEP,StepStone Group,Asset Management,2858000000,0.0313,47.857,0.18886,-0.00298
,STEW,SRH Total Return Fund Inc,Asset Management,1406000000,0.00598,21.894,0.00069,0.00312
,STK,Columbia Seligman Premium Technology Growth Fund Inc,Asset Management,546407000,0.00966,3.885,0.00222,0.00181
,STT,State Street,Asset Management,21763000000,0.01104,12.946,0.00827,-0.00013
,SWKH,SWK Holdings,Asset Management,200936000,0.06597,12.888,0.10604,-0.00186
,SWZ,Swiss Helvetia Fund Inc,Asset Management,104315000,0.00483,5.615,0.00048,0
,TBLD,Thornburg Income Bldr Opport Tr,Asset Management,508498000,0.03267,4.862,0.00341,0.00031
,TCPC,BlackRock Tcp,Asset Management,913257000,0.01303,15.925,0.00431,0.00093
,TDF,Templeton Dragon Fund Inc,Asset Management,205360000,0.01222,-3.202,0.00091,-0.00046
,TEAF,Tortoise Essential Assets Income Term,Asset Management,154743000,0.0174,-25.489,0.00242,0
,TEI,Templeton Emerging Markets Income Fund,Asset Management,250310000,0.01303,7.067,0.00163,-0.00845
,THQ,abrdn Healthcare Opportunities Fund,Asset Management,841596000,0.00793,15.898,0.002,0.00588
,THW,abrdn World Healthcare Fund,Asset Management,495650000,0.01309,12.832,0.00277,0.00154
,TPG,TPG Inc,Asset Management,4155000000,0.02306,-1030.25,0.01653,0
,TPVG,TriplePoint Venture Growth BDC,Asset Management,313743000,0.01805,-7.402,0.02146,-0.003
,TPZ,Tortoise Power & Energy Infra Fd Inc,Asset Management,90709000,0.00586,9.277,0.00285,0
,TROW,T. Rowe Price,Asset Management,26443000000,0.00964,15.26,0.00765,0.00008
,TSI,Tcw Strategic Income Fund Inc,Asset Management,225069000,0.00849,10.021,0.00206,-0.00632
,TSLX,Sixth Street Specialty Lending,Asset Management,1965000000,0.00894,8.119,0.00476,0.00047
,TTP,Tortoise Pipeline & Energy Fund Inc,Asset Management,69817000,0.01646,15.713,0.00185,0
,TURN,180 Degree Capital Corp,Asset Management,36800000,0.01948,-2.706,0.002,-0.00272
,TWN,Taiwan Fund Inc,Asset Management,312887000,0.02284,4.472,0.00204,0
,TY,Tri-Continental Corp,Asset Management,1651000000,0.01489,-5.705,0.00088,-0.00419
,TYG,Tortoise Energy Infrastructure Corp,Asset Management,358580000,0.00752,-27.303,0.00184,-0.00179
,USA,Liberty All Star Equity Fund,Asset Management,1859000000,0.00596,4.603,0.00219,-0.00074
,UTF,Cohen & Steers Infrastructure Fund Inc,Asset Management,2173000000,0.01112,59.368,0.00167,0
,UTG,Reaves Utility Income Fund,Asset Management,2174000000,0.00508,-30.567,0.00282,0.00072
,VBF,Invesco Bond Fund,Asset Management,185321000,0.0154,22.233,0.00189,0.00247
,VCTR,Victory Capital,Asset Management,3131000000,0.01823,15.51,0.01261,0.00185
,VCV,Invesco California Value Municipal Income Trust,Asset Management,486089000,0.01661,11.033,0.00177,-0.00196
,VFL,Delaware Investments Natl Muni Income,Asset Management,127814000,0.00404,-8.262,0.00041,0
,VGI,Virtus Global Multi-Sector Inc,Asset Management,84396000,0.00534,15.872,0.0016,0
,VGM,Invesco Trust for Investment Grade Municipals,Asset Management,549912000,0.00963,11.655,0.00216,-0.00049
,VINP,Vinci Partners Investments,Asset Management,584628000,0.04541,15.552,0.00988,0.00766
,VKI,Invesco Advantage Municipal Income Trust II,Asset Management,391661000,0.00793,11.605,0.0028,0.00227
,VKQ,Invesco Municipal Trust,Asset Management,547268000,0.00604,11.635,0.00209,0.00101
,VLT,Invesco High Income Trust II,Asset Management,68359000,0.01045,9.925,0.00132,0
,VMO,Invesco Municipal Opportunity Trust,Asset Management,670360000,0.014,-5.988,0.0025,-0.00201
,VPV,Invesco Pennsylvania Value Municipal Income Trust,Asset Management,260219000,0.00639,18.2,0.00083,0.00367
,VRTS,Virtus Investment,Asset Management,1563000000,0.01163,12.378,0.01584,-0.00086
,VTN,Invesco Trust For Investment Grade New York Municipals,Asset Management,219319000,0.00712,13.247,0.00114,0.00355
,VVR,Invesco Senior Income Trust,Asset Management,655270000,0.00932,9.304,0.00287,-0.00116
,WDI,WESTERN ASSET DIVERSIFIED INCOME FD,Asset Management,748858000,0.0069,-4.179,0.00385,-0.00241
,WEA,Western Asset Premier Bond Fund,Asset Management,124114000,0.01236,10.058,0.00275,0.00143
,WHF,WhiteHorse Finance,Asset Management,286122000,0.01294,13.989,0.00685,-0.00081
,WHG,Westwood Holdings,Asset Management,111666000,0.00995,10.248,0.001,-0.00083
,WIA,Western Asset Inflation Linked Income Fund,Asset Management,186695000,0.00876,-400.25,0.00075,0
,WIW,Western Asset Inflation-Linked Opportunities and Income Fund,Asset Management,523736000,0.00824,428,0.0025,0
,WT,WisdomTree,Asset Management,1468000000,0.02583,15.109,0.01735,0.00207
,XFLT,XAI Octagon FR & Alt Income Term Trust,Asset Management,388844000,0.00514,5.787,0.00507,0.00049
,ZTR,Virtus Total Return Fund Inc,Asset Management,366208000,0.00753,-3.761,0.00215,-0.00186
,ABG,Asbury Automotive,Auto & Truck Dealerships,4612000000,0.01818,7.956,0.03403,-0.00065
,ACVA,ACV Auctions,Auto & Truck Dealerships,2929000000,0.03109,-37.745,0.01884,0.00112
,AN,AutoNation,Auto & Truck Dealerships,6462000000,0.01742,7.057,0.03653,-0.00074
,CANG,Cango,Auto & Truck Dealerships,174290000,0.06097,-37.955,0.00075,-0.02906
,CARG,CarGurus,Auto & Truck Dealerships,2626000000,0.01515,132.632,0.04132,0
,CARS,Cars.com,Auto & Truck Dealerships,1289000000,0.02156,11.201,0.0221,0.00051
,CRMT,America's Car-Mart,Auto & Truck Dealerships,377030000,0.02865,-11.984,0.03149,0.00406
,CTNT,Cheetah Net Supply Chain Service,Auto & Truck Dealerships,15908000,0.07,70.143,0.05367,-0.02463
,CVNA,Carvana,Auto & Truck Dealerships,13214000000,0.0477,150.653,0.0443,-0.00062
,CWH,Camping World,Auto & Truck Dealerships,809945000,0.03302,32.673,0.04471,-0.00305
,DRVN,Driven Brands,Auto & Truck Dealerships,1967000000,0.04679,-2.647,0.03584,-0.00208
,GORV,Lazydays,Auto & Truck Dealerships,45456000,0.03218,-0.382,0.01359,-0.00308
,GPI,Group 1 Automotive,Auto & Truck Dealerships,4036000000,0.01738,6.98,0.02137,0.0027
,JZXN,Jiuzi,Auto & Truck Dealerships,41196000,0.11689,-0.152,0.0004,0
,KAR,OPENLANE,Auto & Truck Dealerships,1733000000,0.01468,-8.791,0.0155,-0.00218
,KFS,Kingsway Financial Services,Auto & Truck Dealerships,228118000,0.01595,9.18,0.00489,0
,KMX,CarMax,Auto & Truck Dealerships,11269000000,0.05857,23.719,0.03647,0.00223
,KXIN,Kaixin Holdings,Auto & Truck Dealerships,8496000,0.20856,-0.06,0.05296,-0.01334
,LAD,Lithia Motors,Auto & Truck Dealerships,6816000000,0.02186,6.853,0.01826,0.00363
,PAG,Penske Automotive,Auto & Truck Dealerships,10110000000,0.01517,9.754,0.01844,0.00006
,RMBL,RumbleON,Auto & Truck Dealerships,157071000,0.12751,-0.367,0.03444,0.00112
,RUSHA,Rush Enterprises-A,Auto & Truck Dealerships,3358000000,0.01417,10.294,0.00953,0.00138
,RUSHB,Rush Enterprises-B,Auto & Truck Dealerships,3115000000,0.00963,9.547,0.00054,-0.0005
,SAH,Sonic Automotive,Auto & Truck Dealerships,1855000000,0.0202,11.014,0.02926,0.00146
,SDA,SunCar technology,Auto & Truck Dealerships,855017000,0.15019,-27.5,0.01015,0.01352
,UCAR,U Power,Auto & Truck Dealerships,17719000,0.07764,-3.36,0.01374,0.02272
,UXIN,Uxin,Auto & Truck Dealerships,379636000,0.03809,-0.074,0.00123,-0.01463
,VRM,Vroom,Auto & Truck Dealerships,16808000,0.04049,-0.044,0.05456,-0.02307
,AYRO,AYRO Inc,Auto Manufacturers,4224000,0.08036,-0.097,0.01128,-0.01386
,BLBD,Blue Bird,Auto Manufacturers,1738000000,0.04466,72.73,0.02826,0.00353
,CENN,Cenntro Electric,Auto Manufacturers,49018000,0.12209,-0.893,0.02522,0.05705
,CJET,Chijet Motor,Auto Manufacturers,66854000,0.17519,-0.981,0.0251,0.02195
,ECDA,ECD Automotive Design,Auto Manufacturers,31262000,0.02857,-19.6,0.00763,-0.0108
,EVTV,Envirotech Vehicles,Auto Manufacturers,22027000,0.08013,-1.619,0.00444,-0.056
,F,Ford Motor,Auto Manufacturers,47269000000,0.01256,10.963,0.01284,0.0008
,FFIE,Faraday Future Intelligent Electric Inc.,Auto Manufacturers,174305000,0.11433,-0.039,0.10095,-0.00104
,FLYE,Fly-E,Auto Manufacturers,128525000,0.27064,92.982,0.57591,0.03452
,GGR,Gogoro,Auto Manufacturers,389457000,0.04477,-4.375,0.0014,-0.00719
,GM,General Motors,Auto Manufacturers,54447000000,0.01695,6.519,0.01472,0.00083
,GOEV,Canoo,Auto Manufacturers,129031000,0.05524,-0.154,0.05546,-0.00266
,HMC,Honda Motor,Auto Manufacturers,50423000000,0.00475,7.359,0.00034,0.00063
,LCID,Lucid Group,Auto Manufacturers,5745000000,0.02362,-1.831,0.0235,-0.00212
,LI,Li Auto,Auto Manufacturers,18960000000,0.01442,11.687,0.00624,-0.00083
,LOBO,Lobo EV Technologies,Auto Manufacturers,20532000,0.0849,21.092,0.02194,-0.00396
,LOT,Lotus Technology,Auto Manufacturers,4615000000,0.06344,-5.93,0.00065,-0.00294
,LVWR,LiveWire Group,Auto Manufacturers,1467000000,0.03457,-13.37,0.00479,-0.00138
,MULN,Mullen Automotive,Auto Manufacturers,41763000,0.06343,-0.002,0.07437,0.00417
,NIO,NIO Inc,Auto Manufacturers,8975000000,0.02531,-2.51,0.01669,-0.00009
,NIU,Niu Technologies,Auto Manufacturers,142781000,0.04469,-3.857,0.00388,-0.00546
,NWTN,NWTN Inc,Auto Manufacturers,386352000,0.06666,-9.507,0.00014,-0.00001
,PEV,Phoenix Motor,Auto Manufacturers,25783000,0.06256,-0.758,0.00179,-0.00648
,PSNY,Polestar Automotive,Auto Manufacturers,1483000000,0.09972,-3.181,0.05826,0.0108
,PSNYW,POLESTAR AUTOMOTIVE HOLDING UK PLC ADS CL C-1,Auto Manufacturers,263772000,0.16196,-0.566,0.00054,0
,RACE,Ferrari,Auto Manufacturers,74643000000,0.01119,56.148,0.00189,0.00125
,RIVN,Rivian Automotive,Auto Manufacturers,10272000000,0.0271,-1.798,0.04669,-0.00338
,STLA,Stellantis NV,Auto Manufacturers,60542000000,0.01171,3.225,0.00365,0.00195
,SVMH,SRIVARU Holding,Auto Manufacturers,8548000,0.17193,-0.073,0.55324,-0.00092
,TM,Toyota Motor,Auto Manufacturers,260833000000,0.00421,8.408,0.00029,-0.00028
,TSLA,Tesla,Auto Manufacturers,583655000000,0.01795,42.56,0.02273,0.0012
,VEV,Vicinity Motor,Auto Manufacturers,27825000,0.039,-1.693,0.00035,0
,VFS,VinFast Auto,Auto Manufacturers,9118000000,0.0754,-3.967,0.03705,-0.00128
,VLCN,Volcon,Auto Manufacturers,1095000,0.13705,0,0.62331,0.0027
,WKHS,Workhorse,Auto Manufacturers,32082000,0.04705,-0.142,0.04279,-0.00553
,XPEV,XPeng,Auto Manufacturers,7313000000,0.04409,-4.708,0.01342,0.00129
,ZAPP,Zapp Electric Vehicles,Auto Manufacturers,6917000,0.19457,-0.029,1.47402,-0.01777
,ZK,ZEEKR,Auto Manufacturers,5239000000,0.0426,-4.493,0.00998,0.00282
,ADNT,Adient,Auto Parts,2284000000,0.02213,11.828,0.01762,0.00039
,ALSN,Allison Transmission,Auto Parts,6509000000,0.01566,10.055,0.01324,-0.00085
,ALV,Autoliv,Auto Parts,8809000000,0.01912,18.925,0.01648,0.00212
,APTV,Aptiv PLC,Auto Parts,20462000000,0.02839,7.239,0.02514,0.00079
,AXL,American Axle & Mfg,Auto Parts,813467000,0.03455,-23.862,0.03941,0.00217
,BWA,BorgWarner,Auto Parts,7548000000,0.01524,12.408,0.01706,0.00105
,CAAS,China Automotive Systems,Auto Parts,115008000,0.03243,3.048,0.00086,0.01061
,CPS,Cooper-Standard,Auto Parts,198490000,0.0282,-0.986,0.02391,-0.00611
,CREV,Carbon Revolution,Auto Parts,13314000,0.0633,-0.252,0.00122,0
,CVGI,Commercial Vehicle Group,Auto Parts,169483000,0.06204,3.354,0.00679,-0.00203
